{"authority":"CANONICAL_RECORD","completion_assessment":"The chat closeout is a completed full Atlas Sunset at the authored-source lifecycle boundary only. The candidate preserves that prime/integrity is the ordinary required logical gate, prime/windows-compatibility is conditional, and validate (ubuntu-latest) and validate (windows-latest) remain temporary migration bridges while the live GitHub ruleset requires them. This candidate is intended to supply the complementary Windows-not-required observation: prime/integrity succeeds, prime/windows-compatibility is skipped, validate (ubuntu-latest) is satisfied, and validate (windows-latest) remains satisfied through its migration-bridge behavior. PR #247 supplied the Windows-required observation. No Quest completion or Covenant acceptance is claimed.","concurrency":{"declared_source_fingerprint":"sha256:85374d0649abd657c920ea48847883f3aeb7430c6b746857acb4c3dcd665b03d","expected_main_sha":"8d4991b30e9809cee4a7cd3db9fdea3a9b3941cd","expected_parent_feather":"FTR-SCFUZB37GJBLW4SL2JSH32LQBP","expected_quest_revision":2},"decisions":["Treat this as one normal full Atlas Sunset; Prime Ascendant is only the admitted-Quest continuity scope, not a new Sunset type.","Apply ASC-001: prove exactly one new sealed Feather, one immutable Sunset bound to it, and one Sunrise bound to the same Feather/Sunset pair.","Apply ASC-002: observations and successful checks do not self-promote; no Golden Wing is created because recurrence across independent contexts or a justified systemic exception is not established.","Preserve the current Quest position as ACTIVE — ARCHITECTURE REFINEMENT at PA-C01-COVENANT-REFINEMENT with runtime NOT STARTED and no Gitea cutover or legacy route retirement authority.","Keep the eventual ruleset transition separate: observe both Windows-required and Windows-skipped evidence first, then separately authorize new contexts, strict-base behavior, bridge removal, old-context removal, and rollback through reviewed source and settings transactions."],"durable_source_references":[{"authority":"CANONICAL_SOURCE","digest":"sha256:cc99c59d155f5fb09057b9ecdfd81b203919fee417c95985b6b15c5ad60088d2","ref_id":"prime-ascendant-quest","uri":"quests/prime-ascendant.md"},{"authority":"CANONICAL_SOURCE","digest":"sha256:878edadea46c67ce70cf5a6e4402b791010154ea4e219131a40c0bc211a6fea4","ref_id":"prime-ascendant-covenant","uri":"quests/prime-ascendant-covenant.md"},{"authority":"CANONICAL_SOURCE","digest":"sha256:4d16665bc75097fdb2485d27070b2d93e6c856d40cd3052f068c1b10aff8a9f9","ref_id":"lifecycle-contract","uri":"lifecycle/lifecycle-contract.md"},{"authority":"CANONICAL_SOURCE","digest":"sha256:cb532b4216333614773847a445f08e8b6e144c6362767d42fe06b805a09b1b51","ref_id":"lifecycle-construction-contract","uri":"lifecycle/lifecycle-construction-contract.md"},{"authority":"CANONICAL_SOURCE","digest":"sha256:53aa536bbc5e1e8833b640dea318bbbee5e8e19cf97c17e5633b7d6bee038c91","ref_id":"lesson-harvest-protocol","uri":"governance/lesson-harvest-protocol.md"},{"authority":"CANONICAL_SOURCE","digest":"sha256:b62714f7389c125e69487248c5636cc8cf2211a8999fc0f05c993197a24f00cd","ref_id":"assurance-controls","uri":"governance/assurance-controls.json"},{"authority":"CANONICAL_SOURCE","digest":"sha256:0d884bd8bcedc9834b4e258fe507f9e45dead3d736d82293c796a3a8bddccacb","ref_id":"quest-board","uri":"quest-board/quest-board-v1.json"},{"authority":"CANONICAL_SOURCE","digest":"sha256:0f488fbc21c6d8cef3e79767f97bdda5bb164050f6f82a8527ce93a4337e8baf","ref_id":"prime-continuity-register","uri":"continuity/prime-continuity-register-r01.json"},{"authority":"CANONICAL_SOURCE","digest":"sha256:6cc3fedb2f33fa345d8b70d34f3b0251927c10d5c23a230e5bef56b655f0ee60","ref_id":"prime-integrity-validation-doctrine","uri":"tools/prime_checks/targeted_validation.py"}],"evidence_pointers":[{"authority":"EVIDENCE_POINTER","digest":"sha256:cc99c59d155f5fb09057b9ecdfd81b203919fee417c95985b6b15c5ad60088d2","ref_id":"merged-pr-245-naming-architecture-refraction","uri":"quests/prime-ascendant.md"},{"authority":"EVIDENCE_POINTER","digest":"sha256:6cc3fedb2f33fa345d8b70d34f3b0251927c10d5c23a230e5bef56b655f0ee60","ref_id":"merged-pr-246-deterministic-generated-refresh","uri":"tools/prime_checks/targeted_validation.py"},{"authority":"EVIDENCE_POINTER","digest":"sha256:6cc3fedb2f33fa345d8b70d34f3b0251927c10d5c23a230e5bef56b655f0ee60","ref_id":"merged-pr-247-prime-integrity-gitea-phoenix-augmentation","uri":"tests/prime-program/test_targeted_validation.py"},{"authority":"EVIDENCE_POINTER","digest":"sha256:52e6b5037a17181737873aa03205e0e9a562651a7db6f364537ae8fa0e0a9b22","ref_id":"prime-ascendant-continuity-reconciliation","uri":"tests/prime-program/test_prime_ascendant_covenant.py"}],"latest_feather_id":"FTR-DI2NRWYNLEBRSNY7TX6F4YIFMY","lesson_harvest_summary":{"disposition_counts":{"ABSORPTION_REQUIRED":0,"LOCAL_ONLY":2,"NEW_CANDIDATE":0,"REINFORCES_EXISTING":0,"REJECTED":0,"SYSTEMIC_EXCEPTION_CANDIDATE":0},"no_lesson_reason":null,"observation_keys":["asc-001-exact-sunset-cardinality","asc-002-observations-do-not-self-promote"]},"next_approval_gate":"Independent exact-head hosted readback and Strikeforce disposition for this draft-PR publication only; any READY, MERGE, generated refresh, ruleset transition, Quest gate advancement, runtime, Gitea, cutover, or route-retirement action requires separate Jayson authority.","next_safe_action":"After this draft PR reaches unchanged exact-head hosted proof and independent Strikeforce readback, stop at the draft-PR boundary. If separately merged later, create one separate generated-only refresh transaction from the Sunset merge commit and prove generated CURRENT; do not advance PA-C01 or perform runtime, Gitea, cutover, settings, ruleset, or route-retirement work.","open_items":["This Sunset must independently establish the Windows-not-required observation at its unchanged exact draft head: prime/integrity SUCCESS, prime/windows-compatibility SKIPPED, validate (ubuntu-latest) SUCCESS, and validate (windows-latest) satisfied by the conditional migration bridge.","PR #247 already supplied the complementary Windows-required observation; Jayson must separately verify both observations before authorizing any repository ruleset migration.","The separate ruleset transition must retain legacy contexts during observation, verify strict-base behavior, and remove bridge jobs and old required contexts only through later reviewed source and Jayson-controlled settings transactions.","Generated projections are stale after authored PR #247 and this authored Sunset; generated/ remains untouched and requires a separate generated-only refresh transaction after this Sunset is separately merged.","PA-C01 Covenant review remains the next Quest gate; this closeout does not accept the Covenant, advance the Quest, start runtime, activate Gitea, or retire any route."],"operation_id":"operation-nexus","project_id":"project-artemis","protected_data":{"classification":"INTERNAL_CLEAN","clean_summary":"Only sanitized doctrine, public repository identities, merged-PR evidence references, lifecycle state, unresolved work, and restart guidance are included. No credentials, tokens, keys, MFA or recovery codes, private network values, PHI, raw finance or account evidence, private exports, or unredacted logs are stored.","protected_pointers":[]},"quest_scope":{"quest_id":"prime-ascendant","scope_type":"ADMITTED_QUEST"},"record_id":"SUN-F2U7ESSCGSIUAG3HNQQXWDDV4V","schema_id":"atlas.lifecycle.sunset","schema_version":"2.0.0"}
