{"authority":"CANONICAL_RECORD","completion_assessment":"Transactions 0 through 3 are durable merged source with exact-head review, READY, MERGE, and canonical-main receipts. This final authored Sunset closes the chat source transaction; generated projections remain pending Transaction 5, chat-only detail remains noncanonical, and Prime Ascendant runtime and architecture work remain unfinished.","concurrency":{"declared_source_fingerprint":"sha256:98f9585a77c5d3718fd581ced0662c15167269cf0583522a888e4a48682a88d6","expected_main_sha":"aa72a3f8987ddebf064a8e1f7f22988fe838c160","expected_parent_feather":null,"expected_quest_revision":1},"decisions":["Treat the user's established Atlas Sunset meaning as authoritative over a colliding low-level command name.","Bind every completed v2 Sunset to exactly one sealed v2 Feather and matching Sunrise.","Keep one active branch writer and freeze exact base, head, tree, and path inventory at each action gate.","Batch coherent reviewer repairs locally and rerun the complete validation profile before repushing.","Reconcile dependent Covenant and continuity source after merged changes before claiming current truth.","Reject misleading titles, event IDs, paths, provenance labels, or completion claims even when tests pass.","PRs 239 through 242 merged sequentially; Transaction 3 fixed all three Copilot findings and obtained a no-new-comments exact-head rereview.","No Golden Wing is created because the six observations are now Feather-bound and locally enforced, but the available evidence does not independently establish a distinct recurrence corpus or systemic exception requiring a candidate."],"durable_source_references":[{"authority":"CANONICAL_SOURCE","digest":"sha256:54f9d8e6ef9235282829fcd0f91656f467c8b66300cc06659c3458efc2597ca4","ref_id":"prime-ascendant-quest","uri":"quests/prime-ascendant.md"},{"authority":"CANONICAL_SOURCE","digest":"sha256:f413e486cdcf0b0044845ed9ada5ef4a32a24c8be7199679ca6c2ebcd1202f3f","ref_id":"prime-ascendant-covenant","uri":"quests/prime-ascendant-covenant.md"},{"authority":"CANONICAL_SOURCE","digest":"sha256:53aa536bbc5e1e8833b640dea318bbbee5e8e19cf97c17e5633b7d6bee038c91","ref_id":"lesson-harvest-protocol","uri":"governance/lesson-harvest-protocol.md"},{"authority":"CANONICAL_SOURCE","digest":"sha256:1828c32ca24fec3e4d61225e4e22d7b15c81454968526b729259687dd3557000","ref_id":"prime-continuity-register","uri":"continuity/prime-continuity-register-r01.json"},{"authority":"CANONICAL_SOURCE","digest":"sha256:d795a000af1aee89b1681236c2019fd67497ce03df90f3b095732f6b4a9f4700","ref_id":"quest-board","uri":"quest-board/quest-board-v1.json"},{"authority":"CANONICAL_SOURCE","digest":"sha256:4a60520db7b26d1608b55a67cffbd9286765eca8ea8a5644870e92e55be8d516","ref_id":"campaign-warrant-schema","uri":"schemas/shardblade-campaign-warrant-v1.schema.json"},{"authority":"CANONICAL_SOURCE","digest":"sha256:8e3aa1ce6c597a83cdd25d7abdffbfb375442371fb72c284b08a5328d08150b5","ref_id":"campaign-stage-request-schema","uri":"schemas/shardblade-campaign-stage-request-v1.schema.json"},{"authority":"CANONICAL_SOURCE","digest":"sha256:289bcbef6553802307f1a68e895aeb3b64b80c9e40db4bf717252a454c6aab39","ref_id":"campaign-stage-receipt-schema","uri":"schemas/shardblade-campaign-stage-receipt-v1.schema.json"}],"evidence_pointers":[{"authority":"EVIDENCE_POINTER","digest":"sha256:c3dfe90181f3a79a00b43cf793b6c2c6070dca8c22839d909f98097c36997ed0","ref_id":"ascendant-reconciliation-tests","uri":"tests/prime-program/test_prime_ascendant_covenant.py"},{"authority":"EVIDENCE_POINTER","digest":"sha256:1c90c27cc6600251e3bb3cfe00b58a36d7c7cd910bb3e68b2e4c6435ffb9c573","ref_id":"campaign-control-tests","uri":"tests/prime-program/test_shardblade_campaign.py"}],"latest_feather_id":"FTR-SCFUZB37GJBLW4SL2JSH32LQBP","lesson_harvest_summary":{"disposition_counts":{"ABSORPTION_REQUIRED":0,"LOCAL_ONLY":6,"NEW_CANDIDATE":0,"REINFORCES_EXISTING":0,"REJECTED":0,"SYSTEMIC_EXCEPTION_CANDIDATE":0},"no_lesson_reason":null,"observation_keys":["semantic-objective-collision","sunset-feather-binding","single-branch-writer","coherent-repair-batching","dependent-source-reconciliation","semantic-claim-alignment"]},"next_approval_gate":"Transaction 5 may publish only the exact generated refresh from this merged source. After its canonical CURRENT readback, campaign authority expires; any Prime Ascendant runtime, infrastructure, Gitea, route-retirement, repository-settings, or further source action requires a new Jayson-approved warrant.","next_safe_action":"After this exact authored candidate merges and canonical main is verified, execute only Transaction 5's generated refresh, prove canonical generated state CURRENT, and expire the campaign authority.","open_items":["Generated lifecycle and repository projections remain stale until Transaction 5 refreshes them from the merged authored source.","Prime Ascendant remains ACTIVE in PA-C01 architecture refinement with its internal decisions unresolved by design.","Runtime, infrastructure, database deployment, Gitea cutover, route retirement, repository settings, and protected-data operations remain deferred and unauthorized.","Chat-only phrasing and unrestricted transcript context remain noncanonical; only the sanitized source and merged repository evidence are durable.","Campaign rollback remains reviewed revert of a merged PR; pre-merge recovery remains branch closure and regeneration from the exact prior main."],"operation_id":"operation-nexus","project_id":"project-artemis","protected_data":{"classification":"INTERNAL_CLEAN","clean_summary":"Only sanitized doctrine, public repository identities, exact public Git evidence, and clean evidence pointers are included. No credentials, private network values, PHI, raw finance data, unrestricted logs, or protected payloads are present.","protected_pointers":[]},"quest_scope":{"quest_id":"prime-ascendant","scope_type":"ADMITTED_QUEST"},"record_id":"SUN-RMB6SQVXEERPZ7Z557FBF4RWQV","schema_id":"atlas.lifecycle.sunset","schema_version":"2.0.0"}
