{"authority":"CANONICAL_RECORD","completion_assessment":"Mission #319 canonically closes the public-clean Mission Control and Preview-first conversation after Mission #317 / PR #318, while accurately recording Missions #315 and #316 as subsequently completed and generated lifecycle projection freshness as unproven.","concurrency":{"declared_source_fingerprint":"sha256:ec05a7138cd3b1d2de857b78f5279185503ca80c140ea96bc876094d20c364c1","expected_main_sha":"bbd969e94416b559ba70351c8d2dc1da089b600a","expected_parent_feather":null,"expected_quest_revision":null},"decisions":["Mission Control reports only actual actions and read-back-confirmed results.","Decision Boxes remain mobile-first, bounded, and separate from authority.","A complete restart-safe Preview precedes consequential Build work.","Preview Strikeforce and exact-head Build Strikeforce remain distinct risk-scaled gates.","Goddess Mode continues only bounded recoverable work; Shardblade controls unchanged exact-head permanence.","Generated lifecycle projection freshness is not inferred from source merges."],"durable_source_references":[{"authority":"CANONICAL_SOURCE","ref_id":"mission-control-contract","uri":"governance/mission-control-interaction-contract.md"},{"authority":"CANONICAL_SOURCE","ref_id":"ares-contract","uri":"governance/ares.md"},{"authority":"CANONICAL_SOURCE","ref_id":"strikeforce-contract","uri":"governance/atlas-strikeforce.md"},{"authority":"CANONICAL_SOURCE","ref_id":"glass-codex-client-contract","uri":"governance/glass-codex-client-contract.md"},{"authority":"CANONICAL_SOURCE","ref_id":"lifecycle-contract","uri":"lifecycle/lifecycle-contract.md"}],"evidence_pointers":[{"authority":"EVIDENCE_POINTER","ref_id":"mission-317","uri":"github/issues/317"},{"authority":"EVIDENCE_POINTER","ref_id":"pull-318","uri":"github/pulls/318"},{"authority":"EVIDENCE_POINTER","ref_id":"mission-315","uri":"github/issues/315"},{"authority":"EVIDENCE_POINTER","ref_id":"pull-320","uri":"github/pulls/320"},{"authority":"EVIDENCE_POINTER","ref_id":"mission-316","uri":"github/issues/316"},{"authority":"EVIDENCE_POINTER","ref_id":"pull-321","uri":"github/pulls/321"},{"authority":"EVIDENCE_POINTER","ref_id":"mission-319","uri":"github/issues/319"}],"latest_feather_id":"FTR-FA7UPPVD7KEDTOEUYS3SKALQWP","lesson_harvest_summary":{"disposition_counts":{"ABSORPTION_REQUIRED":0,"LOCAL_ONLY":5,"NEW_CANDIDATE":0,"REINFORCES_EXISTING":0,"REJECTED":1,"SYSTEMIC_EXCEPTION_CANDIDATE":0},"no_lesson_reason":null,"observation_keys":["preview-first-storage","risk-scaled-strikeforce","repair-preview-path-expansion","semantic-reconciliation","goddess-shardblade-separation","temporary-review-quota"]},"next_approval_gate":"SEPARATE_GENERATED_REFRESH_OR_NEW_MISSION","next_safe_action":"Use the canonical records for restart context; refresh generated lifecycle projections only through a separate verified generated-refresh transaction.","open_items":["Generated lifecycle projection freshness after PR #318 and the later lifecycle merges remains unproven; no generated-current claim is made.","Any Glass Codex implementation, runtime activation, connector work, or protected operation remains separately authorized.","No Quest, Campaign, or gate advancement is created by this chat-closeout lifecycle transaction."],"operation_id":"operation-harmony","project_id":"project-artemis","protected_data":{"classification":"PUBLIC","clean_summary":"Public-clean repository, Mission, lifecycle, validation, generated-state, and workflow context only; no protected values or runtime evidence are embedded.","protected_pointers":[]},"quest_scope":{"scope_type":"NON_QUEST","work_scope":"Chat-closeout continuity for Mission Control, Decision Boxes, Preview-first planning, Strikeforce, Goddess Mode, and Shardblade boundaries."},"record_id":"SUN-4MJC2Q2VUTYYW2YCV4LUP6IRLG","schema_id":"atlas.lifecycle.sunset","schema_version":"2.0.0"}
