{"authority":"CANONICAL_RECORD","completion_assessment":"Sunset Router R01 is canonical and mechanically proven. The frozen Issue-comment ingress remains live-operator-unproven. Mission 257 remains incomplete until exact Preview approval, lifecycle candidate publication, canonical lifecycle readback, generated-current proof, and final reconciliation.","concurrency":{"declared_source_fingerprint":"sha256:876cdd208f0fae87bf0628b9f4a8147ffcb5a717fa534be070b2497278d0cb07","expected_main_sha":"6e48f5e3fba1e4a1bd826aa64602f616be5d5c89","expected_parent_feather":null,"expected_quest_revision":null},"decisions":["Use the canonical local Sunset Router only for read-only Preview generation in system temporary storage.","Preserve Codex as DELEGATED_NON_ATHENA and select only DELEGATED_ARROW_BOW_THREAD_ENGINE under the explicit operator-transfer authority in resume directive 5039040607.","Keep the Issue-comment Preview ingress frozen and preserve failed runs 29863339953, 29865044542, and 29865867838 plus the direct-owner manual trigger as historical evidence.","Treat Mission 261 as nonblocking and out of scope."],"durable_source_references":[{"authority":"CANONICAL_SOURCE","ref_id":"sunset-router-contract","uri":"governance/sunset-router-contract.md"},{"authority":"CANONICAL_SOURCE","ref_id":"lifecycle-contract","uri":"lifecycle/lifecycle-contract.md"},{"authority":"CANONICAL_SOURCE","ref_id":"mission-board-contract","uri":"governance/mission-board-contract.md"},{"authority":"CANONICAL_SOURCE","ref_id":"recovery-contract","uri":"recovery/elantris-recovery.md"}],"evidence_pointers":[{"authority":"EVIDENCE_POINTER","ref_id":"stage2-router-proof","uri":"proof/mission-257/stage-2-sunset-router-r01.json"},{"authority":"EVIDENCE_POINTER","ref_id":"stage3-ingress-proof","uri":"proof/mission-257/stage-3-execution-surface-r01.json"}],"latest_feather_id":"FTR-KG23DANMBMXCKERGICOJUVQHSB","lesson_harvest_summary":{"disposition_counts":{"ABSORPTION_REQUIRED":0,"LOCAL_ONLY":1,"NEW_CANDIDATE":0,"REINFORCES_EXISTING":0,"REJECTED":0,"SYSTEMIC_EXCEPTION_CANDIDATE":0},"no_lesson_reason":null,"observation_keys":["local-preview-preserves-route-identity"]},"next_approval_gate":"Jayson must approve the exact unchanged Preview ID, Preview digest, and semantic digest with the selected permanence mode.","next_safe_action":"Post the exact lifecycle Preview and Router bindings to Mission 257, then stop until Jayson approves the unchanged Preview.","open_items":["Obtain Jayson's exact approval of the generated Preview.","After approval, compile and verify the same transaction's non-Quest lifecycle candidate before governed publication.","After canonical lifecycle readback, reconcile the separate generated-only refresh and Mission closeout."],"operation_id":"operation-source-governance","project_id":"project-codex","protected_data":{"classification":"PUBLIC","clean_summary":"Only public Mission coordination, canonical repository references, and sanitized lifecycle acceptance evidence are included.","protected_pointers":[]},"quest_scope":{"scope_type":"NON_QUEST","work_scope":"Mission 257 Stage 3 local Sunset Router acceptance and eventual governed lifecycle closeout."},"record_id":"SUN-HZPS7NW7FSTUYWQYHDBYFKXPQI","schema_id":"atlas.lifecycle.sunset","schema_version":"2.0.0"}
