{"authority":"CANONICAL_RECORD","completion_assessment":"Preserve the canonical completion of Decision Box doctrine and Missions #261, #280, #281, #332, and #334; preserve Mission #333 and PR #337 only as closed not-planned and unmerged historical evidence; preserve the approved Worldhopper Relay and Stormfather Mode planning and Mission Board preparation; close this chat through the same Mission #338 reviewed lifecycle transaction without advancing Prime Ascendant.","concurrency":{"declared_source_fingerprint":"sha256:45a704eb4a7b8fff43ebb7982cacfb78de1c67533c3bedf9791380011a48f391","expected_main_sha":"d53070403a7cdd84d800cbf3519c3456f5e6f9bd","expected_parent_feather":"FTR-DI2NRWYNLEBRSNY7TX6F4YIFMY","expected_quest_revision":3},"decisions":["Reuse Mission #338 and attempt 01; do not create another Sunset Mission.","Bind Mission #340 as parent and Mission #339 as the exact declared blocking dependency.","After Mission #339 canonical readback, permit only a one-time declared-dependency reanchor that proves this Preview's semantic digest unchanged; any unrelated or semantic drift returns to Preview.","Create exactly one Feather, one Sunset, one Sunrise, one replacement Prime Ascendant Quest Emberline, and one Quest checkpoint.","Preserve Prime Ascendant as IN_PROGRESS at PA-C01-COVENANT-REFINEMENT with no gate advancement.","Treat Mission #333, PR #337, route failures, and the accidental no-op branch attempt only as historical lessons and never as canonical lifecycle completion.","Keep runtime, protected data, infrastructure, Gitea, repository settings, direct-main, force-push, history rewrite, standing READY, and standing merge authority denied."],"durable_source_references":[{"authority":"CANONICAL_SOURCE","ref_id":"prime-ascendant-quest","uri":"quests/prime-ascendant.md"},{"authority":"CANONICAL_SOURCE","ref_id":"prime-ascendant-covenant","uri":"quests/prime-ascendant-covenant.md"},{"authority":"CANONICAL_SOURCE","ref_id":"mission-control-contract","uri":"governance/mission-control-interaction-contract.md"},{"authority":"CANONICAL_SOURCE","ref_id":"mission-first-handoff","uri":"governance/mission-first-chat-handoff-contract.md"},{"authority":"CANONICAL_SOURCE","ref_id":"lifecycle-contract","uri":"lifecycle/lifecycle-contract.md"},{"authority":"CANONICAL_SOURCE","ref_id":"sunset-router-contract","uri":"governance/sunset-router-contract.md"},{"authority":"CANONICAL_SOURCE","ref_id":"lesson-harvest-protocol","uri":"governance/lesson-harvest-protocol.md"},{"authority":"CANONICAL_SOURCE","ref_id":"prime-continuity-register","uri":"continuity/prime-continuity-register-r01.json"},{"authority":"CANONICAL_SOURCE","ref_id":"quest-registry","uri":"continuity/mission-board-quest-registry-r01.json"}],"evidence_pointers":[{"authority":"EVIDENCE_POINTER","ref_id":"mission-261","uri":"github/issues/261"},{"authority":"EVIDENCE_POINTER","ref_id":"mission-280","uri":"github/issues/280"},{"authority":"EVIDENCE_POINTER","ref_id":"mission-281","uri":"github/issues/281"},{"authority":"EVIDENCE_POINTER","ref_id":"mission-332","uri":"github/issues/332"},{"authority":"EVIDENCE_POINTER","ref_id":"mission-333","uri":"github/issues/333"},{"authority":"EVIDENCE_POINTER","ref_id":"mission-334","uri":"github/issues/334"},{"authority":"EVIDENCE_POINTER","ref_id":"mission-338","uri":"github/issues/338"},{"authority":"EVIDENCE_POINTER","ref_id":"pull-325","uri":"github/pulls/325"},{"authority":"EVIDENCE_POINTER","ref_id":"pull-326","uri":"github/pulls/326"},{"authority":"EVIDENCE_POINTER","ref_id":"pull-327","uri":"github/pulls/327"},{"authority":"EVIDENCE_POINTER","ref_id":"pull-335","uri":"github/pulls/335"},{"authority":"EVIDENCE_POINTER","ref_id":"pull-336","uri":"github/pulls/336"},{"authority":"EVIDENCE_POINTER","ref_id":"pull-337","uri":"github/pulls/337"},{"authority":"EVIDENCE_POINTER","ref_id":"mission-339","uri":"github/issues/339"},{"authority":"EVIDENCE_POINTER","ref_id":"mission-340","uri":"github/issues/340"},{"authority":"EVIDENCE_POINTER","ref_id":"pull-341","uri":"github/pulls/341"}],"latest_feather_id":"FTR-DUXR2GP55SINPLJFGXMVTIU47D","lesson_harvest_summary":{"disposition_counts":{"ABSORPTION_REQUIRED":0,"LOCAL_ONLY":2,"NEW_CANDIDATE":1,"REINFORCES_EXISTING":0,"REJECTED":0,"SYSTEMIC_EXCEPTION_CANDIDATE":0},"no_lesson_reason":null,"observation_keys":["mission-first-chat-handoff","fallback-route-exhaustion","preview-exact-byte-verification"]},"next_approval_gate":"Approve this exact corrected R03 Preview by Preview ID, Preview digest, semantic digest, and approval mode. All later Quest advancement, runtime, protected, infrastructure, Gitea, settings, and ruleset actions remain separately gated.","next_safe_action":"Obtain explicit exact approval bound to this complete compiler-valid corrected Preview. Do not construct a carrier, lifecycle candidate, branch, PR, READY transition, or merge before that approval is independently read back.","open_items":["PA-C01 Covenant acceptance and later application, database, backup, recovery, parity, and cutover work remain unproven.","Runtime, deployment, protected-data transfer, infrastructure activation, Gitea cutover, route retirement, and repository-setting changes remain separately gated."],"operation_id":"operation-harmony","project_id":"project-artemis","protected_data":{"classification":"INTERNAL_CLEAN","clean_summary":"Only public-clean repository, Mission, campaign, PR, lifecycle, decision, validation, blocker, dependency, rollback, and continuity identities are included.","protected_pointers":[]},"quest_scope":{"quest_id":"prime-ascendant","scope_type":"ADMITTED_QUEST"},"record_id":"SUN-752SW3YJISOHSMCQBFBWHN7CPZ","schema_id":"atlas.lifecycle.sunset","schema_version":"2.0.0"}
