{"authority":"CANONICAL_RECORD","completion_assessment":"Mission #316 seals the completed public-clean discussion of Prometheus and Grafana depth, Notum's independent lightweight monitoring role, Cloud Atlas responsibility boundaries, the replaceable Apollo–iCloud–Forge working-file bridge, Mission #313 and PR #314 completion, and Mission #315's now-canonical synchronization repair. It proves no runtime deployment, monitoring activation, UPS telemetry, protected import, Quest advancement, or platform cutover.","concurrency":{"declared_source_fingerprint":"sha256:a26c9135a05d08c5b57f1fd87f2700796b26c0874a0e1fe2a27f3f3564edd84d","expected_main_sha":"9aa371f1e3ebadef018feecd46d55391bab793f1","expected_parent_feather":null,"expected_quest_revision":null},"decisions":["Prometheus and Grafana remain the deeper metrics and analysis layer on the Prometheus substrate.","Notum remains the independent minimal Linux watchtower using Uptime Kuma, conditional NUT telemetry, independent internet-usability checks, and direct alerts.","Harmony, Coppermind, Emberdark, and Perpendicularity retain separate analysis, evidence, ingest, and sanitized-transfer responsibilities.","Apollo–iCloud–Forge is a replaceable working-file bridge and is not a backup system.","Mission #315 and PR #320 provide canonical post-merge parent-Quest synchronization enforcement."],"durable_source_references":[{"authority":"CANONICAL_SOURCE","ref_id":"mission-board-contract","uri":"governance/mission-board-contract.md"},{"authority":"CANONICAL_SOURCE","ref_id":"prime-ascendant-quest","uri":"quests/prime-ascendant.md"},{"authority":"CANONICAL_SOURCE","ref_id":"atlas-infrastructure-source","uri":"infrastructure/atlas-infrastructure-source.md"},{"authority":"CANONICAL_SOURCE","ref_id":"lifecycle-contract","uri":"lifecycle/lifecycle-contract.md"}],"evidence_pointers":[{"authority":"EVIDENCE_POINTER","ref_id":"mission-313","uri":"github/issues/313"},{"authority":"EVIDENCE_POINTER","ref_id":"pull-314","uri":"github/pulls/314"},{"authority":"EVIDENCE_POINTER","ref_id":"mission-315","uri":"github/issues/315"},{"authority":"EVIDENCE_POINTER","ref_id":"pull-320","uri":"github/pulls/320"},{"authority":"EVIDENCE_POINTER","ref_id":"mission-316","uri":"github/issues/316"}],"latest_feather_id":"FTR-YYT5EL7BHQAEHNSMIYEPDMTCDZ","lesson_harvest_summary":{"disposition_counts":{"ABSORPTION_REQUIRED":0,"LOCAL_ONLY":4,"NEW_CANDIDATE":0,"REINFORCES_EXISTING":0,"REJECTED":1,"SYSTEMIC_EXCEPTION_CANDIDATE":0},"no_lesson_reason":null,"observation_keys":["quest-sync-enforcement","responsibility-separation","independent-monitoring","automatic-notum-continuity","temporary-ci-debugging"]},"next_approval_gate":"SEPARATE_AUTHORITY_REQUIRED","next_safe_action":"Use these records for future restart context; any runtime, protected, infrastructure, or Quest-state change requires a separate authorized Mission and exact proof.","open_items":["Notum installation, Linux configuration, UPS connection, telemetry, alert delivery, monitoring activation, and runtime recovery remain unproven and separately authorized.","Prometheus and Grafana deployment or reconfiguration remains outside this Sunset.","Gitea cutover, protected-data import, and Quest or Campaign advancement remain unproven."],"operation_id":"operation-harmony","project_id":"project-artemis","protected_data":{"classification":"PUBLIC","clean_summary":"Public-clean repository, Mission, lifecycle, architecture, monitoring, and workflow context only; no protected values or runtime evidence are embedded.","protected_pointers":[]},"quest_scope":{"scope_type":"NON_QUEST","work_scope":"Cross-Quest continuity for Notum, monitoring, Cloud Atlas responsibilities, working-file bridge boundaries, and Mission Board synchronization."},"record_id":"SUN-77S5V4YRES3P2O3BOPO4TRA4AV","schema_id":"atlas.lifecycle.sunset","schema_version":"2.0.0"}
