{"authority":"CANONICAL_RECORD","completion_assessment":"Ciel's Awakening and First Gluttony are complete in canonical Prime: 21 reviewed Harvest Records, 21 paired reviewed Absorption Records, 45 atomic findings, zero Code Capsules, completed historical Issues #328 and #330, and no active Quest-registry or unfinished-continuity entry remain. This Sunset preserves that durable result without reactivating the completed Quest or promoting Rimuru evidence.","concurrency":{"declared_source_fingerprint":"sha256:19f3d1f49bee9198aa00ef9ce4069392922737cd4d8a52c46fdef9910a6ecf48","expected_main_sha":"a59ccde1dc6350e353f65c6e47a040f0e9627720","expected_parent_feather":null,"expected_quest_revision":null},"decisions":["Classify this lifecycle transaction as NON_QUEST because Ciel's Awakening is complete and absent from the active Quest registry and unfinished continuity.","Create exactly one sealed Feather, one immutable Sunset bound to that Feather, and one paired Sunrise; create no Quest Emberline replacement and no Quest checkpoint.","Preserve Operation Ciel, Harvest to Absorb, Gluttony, noncanonical Rimuru, 21 reviewed Harvest Records, 21 paired reviewed Absorption Records, 45 atomic findings, zero Code Capsules, and historical Issues #328 and #330.","Keep the prepublication validation follow-up as a NEW_CANDIDATE obligation only; do not create or promote a Golden Wing or assurance control.","Use Athena Spear through the mission-scoped Thread Engine as the selected route, with Athena Phoenix Blade then Athena Aegis Break as ordered fallbacks.","Keep all runtime, infrastructure, protected-data, Quest advancement, repository-setting, force-push, direct-main, and history-rewrite authority denied."],"durable_source_references":[{"authority":"CANONICAL_SOURCE","ref_id":"ciels-awakening-quest-history","uri":"quests/ciels-awakening.md"},{"authority":"CANONICAL_SOURCE","ref_id":"operation-ciel","uri":"operations/ciel.md"},{"authority":"CANONICAL_SOURCE","ref_id":"rimuru-registry","uri":"knowledge/rimuru/registry-r01.json"},{"authority":"CANONICAL_SOURCE","ref_id":"lifecycle-contract","uri":"lifecycle/lifecycle-contract.md"},{"authority":"CANONICAL_SOURCE","ref_id":"lesson-harvest-protocol","uri":"governance/lesson-harvest-protocol.md"},{"authority":"CANONICAL_SOURCE","ref_id":"mission-first-chat-handoff","uri":"governance/mission-first-chat-handoff-contract.md"}],"evidence_pointers":[],"latest_feather_id":"FTR-CI5JXXF4TLBKDP25GEY32QP3CD","lesson_harvest_summary":{"disposition_counts":{"ABSORPTION_REQUIRED":0,"LOCAL_ONLY":3,"NEW_CANDIDATE":1,"REINFORCES_EXISTING":0,"REJECTED":0,"SYSTEMIC_EXCEPTION_CANDIDATE":0},"no_lesson_reason":null,"observation_keys":["ciel-prepublication-semantic-validation","ciel-zero-delta-tree-readback","ciel-append-only-completion-receipts","ciel-strikeforce-pass-five"]},"next_approval_gate":"Any future Golden Wing or assurance-control promotion, implementation Mission, runtime action, protected-data access, Quest reactivation, or infrastructure action requires a separate exact Jayson approval.","next_safe_action":"After exact merged-main readback closes Mission #332, preserve the prepublication-validation NEW_CANDIDATE as an unpromoted follow-up and admit it only through a separate public-clean Mission and Preview if Jayson chooses to pursue it.","open_items":["The NEW_CANDIDATE prepublication-validation observation remains a separate unpromoted follow-up obligation and is not admitted or implemented by this Sunset.","Runtime, deployment, protected-data transfer, repository settings, Quest reactivation, infrastructure action, Golden Wing promotion, and assurance-control mutation remain unproven and separately gated."],"operation_id":"operation-ciel","project_id":"project-artemis","protected_data":{"classification":"INTERNAL_CLEAN","clean_summary":"Only public-clean Atlas decisions, repository and Mission identities, source paths, hashes, validation results, sanitized lessons, recovery, and rollback are included. Secrets, credentials, PHI, raw financial, legal, tax, insurance, brokerage, account, private network, private runtime, raw export, personal archive, and unrestricted log values are excluded.","protected_pointers":[]},"quest_scope":{"scope_type":"NON_QUEST","work_scope":"Completed Ciel's Awakening and First Gluttony historical closeout under Operation Ciel."},"record_id":"SUN-VNLF67ZMIDGSWNBYQLQLFLP2WO","schema_id":"atlas.lifecycle.sunset","schema_version":"2.0.0"}
